14:40:20.276349 ens33 curl.23592 Out IP 10.0.2.15.43950 > 139.178.84.217.443: Flags [S], seq 2716706921, win 64240, options [mss 1460,sackOK,TS val 3379641114 ecr 0,nop,wscale 7], length 0, ParentProc [bash.6007]
14:40:20.780518 ens33 curl.23592 In IP 139.178.84.217.443 > 10.0.2.15.43950: Flags [S.], seq 676670157, ack 2716706922, win 64240, options [mss 1460], length 0, ParentProc [bash.6007]
14:40:20.780771 ens33 curl.23592 Out IP 10.0.2.15.43950 > 139.178.84.217.443: Flags [.], seq 2716706922, ack 676670158, win 64240, length 0, ParentProc [bash.6007]
14:40:20.790480 ens33 curl.23592 In IP 139.178.84.217.443 > 10.0.2.15.43950: Flags [.], seq 676670158, ack 2716707439, win 64240, length 0, ParentProc [bash.6007]
14:40:20.790422 ens33 curl.23592 Out IP 10.0.2.15.43950 > 139.178.84.217.443: Flags [P.], seq 2716706922:2716707439, ack 676670158, win 64240, length 517, ParentProc [bash.6007]
