02:00:37.400239 ens33 curl.122868 Out IP 10.0.2.15.53258 > 198.185.159.144.80: Flags [S], seq 1249028847, win 64240, options [mss 1460,sackOK,TS val 3410064770 ecr 0,nop,wscale 7], length 0, Thread [curl.122868], ParentProc [bash.53229]
02:00:37.918397 ens33 curl.122868 In IP 198.185.159.144.80 > 10.0.2.15.53258: Flags [S.], seq 2029530089, ack 1249028848, win 64240, options [mss 1460], length 0, ParentProc [bash.53229]
02:00:37.918739 ens33 curl.122868 Out IP 10.0.2.15.53258 > 198.185.159.144.80: Flags [.], seq 1249028848, ack 2029530090, win 64240, length 0, ParentProc [bash.53229]
02:00:37.918979 ens33 curl.122868 Out IP 10.0.2.15.53258 > 198.185.159.144.80: Flags [P.], seq 1249028848:1249028921, ack 2029530090, win 64240, length 73, Thread [curl.122868], ParentProc [bash.53229]
02:00:37.919376 ens33 curl.122868 In IP 198.185.159.144.80 > 10.0.2.15.53258: Flags [.], seq 2029530090, ack 1249028921, win 64240, length 0, ParentProc [bash.53229]
02:00:38.459435 ens33 curl.122868 In IP 198.185.159.144.80 > 10.0.2.15.53258: Flags [P.], seq 2029530090:2029530342, ack 1249028921, win 64240, length 252, ParentProc [bash.53229]
02:00:38.459846 ens33 curl.122868 Out IP 10.0.2.15.53258 > 198.185.159.144.80: Flags [.], seq 1249028921, ack 2029530342, win 63988, length 0, ParentProc [bash.53229]
02:00:38.460535 ens33 curl.122868 Out IP 10.0.2.15.53258 > 198.185.159.144.80: Flags [F.], seq 1249028921, ack 2029530342, win 63988, length 0, Thread [curl.122868], ParentProc [bash.53229]
02:00:38.462021 ens33 curl.122868 In IP 198.185.159.144.80 > 10.0.2.15.53258: Flags [.], seq 2029530342, ack 1249028922, win 64239, length 0, ParentProc [bash.53229]
02:00:38.973317 ens33 curl.122868 Out IP 10.0.2.15.53258 > 198.185.159.144.80: Flags [.], seq 1249028922, ack 2029530343, win 63988, length 0, ParentProc [bash.53229]
