02:00:37.400239 ens33 curl.122868 Out IP 10.0.2.15.53258 > 198.185.159.144.80: Flags [S], seq 1249028847, win 64240, options [mss 1460,sackOK,TS val 3410064770 ecr 0,nop,wscale 7], length 0, Thread [curl.122868], ParentProc [bash.53229]
02:00:37.918397 ens33 curl.122868 In IP 198.185.159.144.80 > 10.0.2.15.53258: Flags [S.], seq 2029530089, ack 1249028848, win 64240, options [mss 1460], length 0, ParentProc [bash.53229]
02:00:37.918739 ens33 curl.122868 Out IP 10.0.2.15.53258 > 198.185.159.144.80: Flags [.], ack 1, win 64240, length 0, ParentProc [bash.53229]
02:00:37.918979 ens33 curl.122868 Out IP 10.0.2.15.53258 > 198.185.159.144.80: Flags [P.], seq 1:74, ack 1, win 64240, length 73: HTTP: GET / HTTP/1.1, Thread [curl.122868], ParentProc [bash.53229]
02:00:37.919376 ens33 curl.122868 In IP 198.185.159.144.80 > 10.0.2.15.53258: Flags [.], ack 74, win 64240, length 0, ParentProc [bash.53229]
02:00:38.459435 ens33 curl.122868 In IP 198.185.159.144.80 > 10.0.2.15.53258: Flags [P.], seq 1:253, ack 74, win 64240, length 252: HTTP: HTTP/1.1 302 Found, ParentProc [bash.53229]
02:00:38.459846 ens33 curl.122868 Out IP 10.0.2.15.53258 > 198.185.159.144.80: Flags [.], ack 253, win 63988, length 0, ParentProc [bash.53229]
02:00:38.460535 ens33 curl.122868 Out IP 10.0.2.15.53258 > 198.185.159.144.80: Flags [F.], seq 74, ack 253, win 63988, length 0, Thread [curl.122868], ParentProc [bash.53229]
02:00:38.462021 ens33 curl.122868 In IP 198.185.159.144.80 > 10.0.2.15.53258: Flags [.], ack 75, win 64239, length 0, ParentProc [bash.53229]
02:00:38.973317 ens33 curl.122868 Out IP 10.0.2.15.53258 > 198.185.159.144.80: Flags [.], ack 254, win 63988, length 0, ParentProc [bash.53229]
