02:55:35.698856 IP 127.0.0.1.34204 > 127.0.0.1.12345: Flags [S], seq 412382786, win 65495, options [mss 65495,sackOK,TS val 642407978 ecr 0,nop,wscale 7,mptcp 4 capable v1 flags [H]], length 0
02:55:35.698936 IP 127.0.0.1.12345 > 127.0.0.1.34204: Flags [S.], seq 2707981557, ack 412382787, win 65483, options [mss 65495,sackOK,TS val 642407978 ecr 642407978,nop,wscale 7,mptcp 12 capable v1 flags [H] {0xe356a8f252e41976}], length 0
02:55:35.699025 IP 127.0.0.1.34204 > 127.0.0.1.12345: Flags [.], seq 412382787, ack 2707981558, win 512, options [nop,nop,TS val 642407978 ecr 642407978,mptcp 20 capable v1 flags [H] {0xfe7b93dc894dcb73,0xe356a8f252e41976}], length 0
02:55:38.509583 IP 127.0.0.1.34204 > 127.0.0.1.12345: Flags [P.], seq 412382787:412382792, ack 2707981558, win 512, options [nop,nop,TS val 642410789 ecr 642407978,mptcp 22 capable v1 flags [H] {0xfe7b93dc894dcb73,0xe356a8f252e41976,data_len=5},nop,nop], length 5
02:55:38.509749 IP 127.0.0.1.12345 > 127.0.0.1.34204: Flags [.], seq 2707981558, ack 412382792, win 512, options [nop,nop,TS val 642410789 ecr 642410789,mptcp 12 dss ack 3891854986895050400], length 0
02:55:39.975370 IP 127.0.0.1.34204 > 127.0.0.1.12345: Flags [P.], seq 412382792:412382796, ack 2707981558, win 512, options [nop,nop,TS val 642412254 ecr 642410789,mptcp 22 dss ack 2876660120 seq 3891854986895050400 subseq 6 len 4,nop,nop], length 4
02:55:39.975475 IP 127.0.0.1.12345 > 127.0.0.1.34204: Flags [.], seq 2707981558, ack 412382796, win 512, options [nop,nop,TS val 642412254 ecr 642412254,mptcp 12 dss ack 3891854986895050404], length 0
02:55:41.167860 IP 127.0.0.1.34204 > 127.0.0.1.12345: Flags [.], seq 412382796, ack 2707981558, win 512, options [nop,nop,TS val 642412255 ecr 642412254,mptcp 22 dss fin ack 2876660120 seq 3891854986895050404 subseq 0 len 1,nop,nop], length 0
02:55:41.168004 IP 127.0.0.1.12345 > 127.0.0.1.34204: Flags [.], seq 2707981558, ack 412382796, win 512, options [nop,nop,TS val 642413447 ecr 642412255,mptcp 12 dss ack 3891854986895050405], length 0
02:55:41.168074 IP 127.0.0.1.12345 > 127.0.0.1.34204: Flags [.], seq 2707981558, ack 412382796, win 512, options [nop,nop,TS val 642413447 ecr 642412255,mptcp 26 dss fin ack 3891854986895050405 seq 16853452819136928152 subseq 0 len 1,nop,nop], length 0
02:55:41.168388 IP 127.0.0.1.34204 > 127.0.0.1.12345: Flags [.], seq 412382796, ack 2707981558, win 512, options [nop,nop,TS val 642413447 ecr 642413447,mptcp 8 dss ack 2876660121], length 0
02:55:41.168407 IP 127.0.0.1.34204 > 127.0.0.1.12345: Flags [F.], seq 412382796, ack 2707981558, win 512, options [nop,nop,TS val 642413447 ecr 642413447,mptcp 8 dss ack 2876660121], length 0
02:55:41.168427 IP 127.0.0.1.12345 > 127.0.0.1.34204: Flags [F.], seq 2707981558, ack 412382797, win 512, options [nop,nop,TS val 642413447 ecr 642413447,mptcp 12 dss ack 3891854986895050405], length 0
02:55:41.168438 IP 127.0.0.1.34204 > 127.0.0.1.12345: Flags [.], seq 412382797, ack 2707981559, win 512, options [nop,nop,TS val 642413448 ecr 642413447,mptcp 8 dss ack 2876660121], length 0
