13:50:35.524360 lo curl.345650 Out IP 127.0.0.1.58694 > 127.0.0.1.8000: Flags [S], seq 217911223, win 65495, options [mss 65495,sackOK,TS val 2363239505 ecr 0,nop,wscale 7], length 0, ParentProc [ptcpdump.345626]
13:50:35.524995 lo curl.345650 In IP 127.0.0.1.58694 > 127.0.0.1.8000: Flags [S], seq 217911223, win 65495, options [mss 65495,sackOK,TS val 2363239505 ecr 0,nop,wscale 7], length 0, ParentProc [ptcpdump.345626]
13:50:35.525108 lo curl.345650 Out IP 127.0.0.1.8000 > 127.0.0.1.58694: Flags [S.], seq 3879633683, ack 217911224, win 65483, options [mss 65495,sackOK,TS val 2363239505 ecr 2363239505,nop,wscale 7], length 0, ParentProc [ptcpdump.345626]
13:50:35.525211 lo curl.345650 In IP 127.0.0.1.8000 > 127.0.0.1.58694: Flags [S.], seq 3879633683, ack 217911224, win 65483, options [mss 65495,sackOK,TS val 2363239505 ecr 2363239505,nop,wscale 7], length 0, ParentProc [ptcpdump.345626]
13:50:35.525339 lo curl.345650 Out IP 127.0.0.1.58694 > 127.0.0.1.8000: Flags [.], ack 1, win 512, options [nop,nop,TS val 2363239505 ecr 2363239505], length 0, ParentProc [ptcpdump.345626]
13:50:35.525396 lo curl.345650 In IP 127.0.0.1.58694 > 127.0.0.1.8000: Flags [.], ack 1, win 512, options [nop,nop,TS val 2363239505 ecr 2363239505], length 0, ParentProc [ptcpdump.345626]
13:50:35.525536 lo curl.345650 Out IP 127.0.0.1.58694 > 127.0.0.1.8000: Flags [P.], seq 1:87, ack 1, win 512, options [nop,nop,TS val 2363239505 ecr 2363239505], length 86: HTTP: GET /notfound HTTP/1.1, ParentProc [ptcpdump.345626]
13:50:35.525652 lo curl.345650 In IP 127.0.0.1.58694 > 127.0.0.1.8000: Flags [P.], seq 1:87, ack 1, win 512, options [nop,nop,TS val 2363239505 ecr 2363239505], length 86: HTTP: GET /notfound HTTP/1.1, ParentProc [ptcpdump.345626]
13:50:35.525721 lo curl.345650 Out IP 127.0.0.1.8000 > 127.0.0.1.58694: Flags [.], ack 87, win 511, options [nop,nop,TS val 2363239505 ecr 2363239505], length 0, ParentProc [ptcpdump.345626]
13:50:35.525804 lo curl.345650 In IP 127.0.0.1.8000 > 127.0.0.1.58694: Flags [.], ack 87, win 511, options [nop,nop,TS val 2363239505 ecr 2363239505], length 0, ParentProc [ptcpdump.345626]
13:50:35.558547 lo curl.345650 Out IP 127.0.0.1.8000 > 127.0.0.1.58694: Flags [P.], seq 1:187, ack 87, win 512, options [nop,nop,TS val 2363239522 ecr 2363239505], length 186: HTTP: HTTP/1.0 404 File not found, ParentProc [ptcpdump.345626]
13:50:35.558929 lo curl.345650 In IP 127.0.0.1.8000 > 127.0.0.1.58694: Flags [P.], seq 1:187, ack 87, win 512, options [nop,nop,TS val 2363239522 ecr 2363239505], length 186: HTTP: HTTP/1.0 404 File not found, ParentProc [ptcpdump.345626]
13:50:35.559171 lo curl.345650 Out IP 127.0.0.1.58694 > 127.0.0.1.8000: Flags [.], ack 187, win 511, options [nop,nop,TS val 2363239522 ecr 2363239522], length 0, ParentProc [ptcpdump.345626]
13:50:35.559277 lo curl.345650 In IP 127.0.0.1.58694 > 127.0.0.1.8000: Flags [.], ack 187, win 511, options [nop,nop,TS val 2363239522 ecr 2363239522], length 0, ParentProc [ptcpdump.345626]
13:50:35.559705 lo curl.345650 Out IP 127.0.0.1.58694 > 127.0.0.1.8000: Flags [F.], seq 87, ack 656, win 512, options [nop,nop,TS val 2363239522 ecr 2363239522], length 0, ParentProc [ptcpdump.345626]
13:50:35.559765 lo curl.345650 In IP 127.0.0.1.58694 > 127.0.0.1.8000: Flags [F.], seq 87, ack 656, win 512, options [nop,nop,TS val 2363239522 ecr 2363239522], length 0, ParentProc [ptcpdump.345626]
13:50:35.559522 lo curl.345650 Out IP 127.0.0.1.8000 > 127.0.0.1.58694: Flags [P.], seq 187:656, ack 87, win 512, options [nop,nop,TS val 2363239522 ecr 2363239522], length 469, ParentProc [ptcpdump.345626]
13:50:35.559608 lo curl.345650 In IP 127.0.0.1.8000 > 127.0.0.1.58694: Flags [P.], seq 187:656, ack 87, win 512, options [nop,nop,TS val 2363239522 ecr 2363239522], length 469, ParentProc [ptcpdump.345626]
13:50:35.559705 lo curl.345650 Out IP 127.0.0.1.58694 > 127.0.0.1.8000: Flags [.], ack 656, win 508, options [nop,nop,TS val 2363239522 ecr 2363239522], length 0, ParentProc [ptcpdump.345626]
13:50:35.559768 lo curl.345650 In IP 127.0.0.1.58694 > 127.0.0.1.8000: Flags [.], ack 656, win 508, options [nop,nop,TS val 2363239522 ecr 2363239522], length 0, ParentProc [ptcpdump.345626]
13:50:35.560427 lo curl.345650 Out IP 127.0.0.1.8000 > 127.0.0.1.58694: Flags [F.], seq 656, ack 88, win 512, options [nop,nop,TS val 2363239523 ecr 2363239522], length 0, ParentProc [ptcpdump.345626]
13:50:35.560491 lo curl.345650 In IP 127.0.0.1.8000 > 127.0.0.1.58694: Flags [F.], seq 656, ack 88, win 512, options [nop,nop,TS val 2363239523 ecr 2363239522], length 0, ParentProc [ptcpdump.345626]
13:50:35.560549 lo curl.345650 Out IP 127.0.0.1.58694 > 127.0.0.1.8000: Flags [.], ack 657, win 512, options [nop,nop,TS val 2363239523 ecr 2363239523], length 0, ParentProc [ptcpdump.345626]
13:50:35.560602 lo curl.345650 In IP 127.0.0.1.58694 > 127.0.0.1.8000: Flags [.], ack 657, win 512, options [nop,nop,TS val 2363239523 ecr 2363239523], length 0, ParentProc [ptcpdump.345626]
