13:50:35.524360149 lo curl.345650 Out IP 127.0.0.1.58694 > 127.0.0.1.8000: Flags [S], seq 217911223, win 65495, options [mss 65495,sackOK,TS val 2363239505 ecr 0,nop,wscale 7], length 0, ParentProc [ptcpdump.345626]
13:50:35.524995449 lo curl.345650 In IP 127.0.0.1.58694 > 127.0.0.1.8000: Flags [S], seq 217911223, win 65495, options [mss 65495,sackOK,TS val 2363239505 ecr 0,nop,wscale 7], length 0, ParentProc [ptcpdump.345626]
13:50:35.525108076 lo curl.345650 Out IP 127.0.0.1.8000 > 127.0.0.1.58694: Flags [S.], seq 3879633683, ack 217911224, win 65483, options [mss 65495,sackOK,TS val 2363239505 ecr 2363239505,nop,wscale 7], length 0, ParentProc [ptcpdump.345626]
13:50:35.525211455 lo curl.345650 In IP 127.0.0.1.8000 > 127.0.0.1.58694: Flags [S.], seq 3879633683, ack 217911224, win 65483, options [mss 65495,sackOK,TS val 2363239505 ecr 2363239505,nop,wscale 7], length 0, ParentProc [ptcpdump.345626]
13:50:35.525339808 lo curl.345650 Out IP 127.0.0.1.58694 > 127.0.0.1.8000: Flags [.], ack 1, win 512, options [nop,nop,TS val 2363239505 ecr 2363239505], length 0, ParentProc [ptcpdump.345626]
13:50:35.525396791 lo curl.345650 In IP 127.0.0.1.58694 > 127.0.0.1.8000: Flags [.], ack 1, win 512, options [nop,nop,TS val 2363239505 ecr 2363239505], length 0, ParentProc [ptcpdump.345626]
13:50:35.525536185 lo curl.345650 Out IP 127.0.0.1.58694 > 127.0.0.1.8000: Flags [P.], seq 1:87, ack 1, win 512, options [nop,nop,TS val 2363239505 ecr 2363239505], length 86: HTTP: GET /notfound HTTP/1.1, ParentProc [ptcpdump.345626]
13:50:35.525652296 lo curl.345650 In IP 127.0.0.1.58694 > 127.0.0.1.8000: Flags [P.], seq 1:87, ack 1, win 512, options [nop,nop,TS val 2363239505 ecr 2363239505], length 86: HTTP: GET /notfound HTTP/1.1, ParentProc [ptcpdump.345626]
13:50:35.525721980 lo curl.345650 Out IP 127.0.0.1.8000 > 127.0.0.1.58694: Flags [.], ack 87, win 511, options [nop,nop,TS val 2363239505 ecr 2363239505], length 0, ParentProc [ptcpdump.345626]
13:50:35.525804602 lo curl.345650 In IP 127.0.0.1.8000 > 127.0.0.1.58694: Flags [.], ack 87, win 511, options [nop,nop,TS val 2363239505 ecr 2363239505], length 0, ParentProc [ptcpdump.345626]
13:50:35.558547738 lo curl.345650 Out IP 127.0.0.1.8000 > 127.0.0.1.58694: Flags [P.], seq 1:187, ack 87, win 512, options [nop,nop,TS val 2363239522 ecr 2363239505], length 186: HTTP: HTTP/1.0 404 File not found, ParentProc [ptcpdump.345626]
13:50:35.558929678 lo curl.345650 In IP 127.0.0.1.8000 > 127.0.0.1.58694: Flags [P.], seq 1:187, ack 87, win 512, options [nop,nop,TS val 2363239522 ecr 2363239505], length 186: HTTP: HTTP/1.0 404 File not found, ParentProc [ptcpdump.345626]
13:50:35.559171150 lo curl.345650 Out IP 127.0.0.1.58694 > 127.0.0.1.8000: Flags [.], ack 187, win 511, options [nop,nop,TS val 2363239522 ecr 2363239522], length 0, ParentProc [ptcpdump.345626]
13:50:35.559277897 lo curl.345650 In IP 127.0.0.1.58694 > 127.0.0.1.8000: Flags [.], ack 187, win 511, options [nop,nop,TS val 2363239522 ecr 2363239522], length 0, ParentProc [ptcpdump.345626]
13:50:35.559705593 lo curl.345650 Out IP 127.0.0.1.58694 > 127.0.0.1.8000: Flags [F.], seq 87, ack 656, win 512, options [nop,nop,TS val 2363239522 ecr 2363239522], length 0, ParentProc [ptcpdump.345626]
13:50:35.559765733 lo curl.345650 In IP 127.0.0.1.58694 > 127.0.0.1.8000: Flags [F.], seq 87, ack 656, win 512, options [nop,nop,TS val 2363239522 ecr 2363239522], length 0, ParentProc [ptcpdump.345626]
13:50:35.559522050 lo curl.345650 Out IP 127.0.0.1.8000 > 127.0.0.1.58694: Flags [P.], seq 187:656, ack 87, win 512, options [nop,nop,TS val 2363239522 ecr 2363239522], length 469, ParentProc [ptcpdump.345626]
13:50:35.559608806 lo curl.345650 In IP 127.0.0.1.8000 > 127.0.0.1.58694: Flags [P.], seq 187:656, ack 87, win 512, options [nop,nop,TS val 2363239522 ecr 2363239522], length 469, ParentProc [ptcpdump.345626]
13:50:35.559705946 lo curl.345650 Out IP 127.0.0.1.58694 > 127.0.0.1.8000: Flags [.], ack 656, win 508, options [nop,nop,TS val 2363239522 ecr 2363239522], length 0, ParentProc [ptcpdump.345626]
13:50:35.559768964 lo curl.345650 In IP 127.0.0.1.58694 > 127.0.0.1.8000: Flags [.], ack 656, win 508, options [nop,nop,TS val 2363239522 ecr 2363239522], length 0, ParentProc [ptcpdump.345626]
13:50:35.560427037 lo curl.345650 Out IP 127.0.0.1.8000 > 127.0.0.1.58694: Flags [F.], seq 656, ack 88, win 512, options [nop,nop,TS val 2363239523 ecr 2363239522], length 0, ParentProc [ptcpdump.345626]
13:50:35.560491399 lo curl.345650 In IP 127.0.0.1.8000 > 127.0.0.1.58694: Flags [F.], seq 656, ack 88, win 512, options [nop,nop,TS val 2363239523 ecr 2363239522], length 0, ParentProc [ptcpdump.345626]
13:50:35.560549335 lo curl.345650 Out IP 127.0.0.1.58694 > 127.0.0.1.8000: Flags [.], ack 657, win 512, options [nop,nop,TS val 2363239523 ecr 2363239523], length 0, ParentProc [ptcpdump.345626]
13:50:35.560602110 lo curl.345650 In IP 127.0.0.1.58694 > 127.0.0.1.8000: Flags [.], ack 657, win 512, options [nop,nop,TS val 2363239523 ecr 2363239523], length 0, ParentProc [ptcpdump.345626]
