00:00:00.000000 lo curl.345650 Out IP 127.0.0.1.58694 > 127.0.0.1.8000: Flags [S], seq 217911223, win 65495, options [mss 65495,sackOK,TS val 2363239505 ecr 0,nop,wscale 7], length 0, ParentProc [ptcpdump.345626]
00:00:00.000635 lo curl.345650 In IP 127.0.0.1.58694 > 127.0.0.1.8000: Flags [S], seq 217911223, win 65495, options [mss 65495,sackOK,TS val 2363239505 ecr 0,nop,wscale 7], length 0, ParentProc [ptcpdump.345626]
00:00:00.000112 lo curl.345650 Out IP 127.0.0.1.8000 > 127.0.0.1.58694: Flags [S.], seq 3879633683, ack 217911224, win 65483, options [mss 65495,sackOK,TS val 2363239505 ecr 2363239505,nop,wscale 7], length 0, ParentProc [ptcpdump.345626]
00:00:00.000103 lo curl.345650 In IP 127.0.0.1.8000 > 127.0.0.1.58694: Flags [S.], seq 3879633683, ack 217911224, win 65483, options [mss 65495,sackOK,TS val 2363239505 ecr 2363239505,nop,wscale 7], length 0, ParentProc [ptcpdump.345626]
00:00:00.000128 lo curl.345650 Out IP 127.0.0.1.58694 > 127.0.0.1.8000: Flags [.], seq 217911224, ack 3879633684, win 512, options [nop,nop,TS val 2363239505 ecr 2363239505], length 0, ParentProc [ptcpdump.345626]
00:00:00.000056 lo curl.345650 In IP 127.0.0.1.58694 > 127.0.0.1.8000: Flags [.], seq 217911224, ack 3879633684, win 512, options [nop,nop,TS val 2363239505 ecr 2363239505], length 0, ParentProc [ptcpdump.345626]
00:00:00.000139 lo curl.345650 Out IP 127.0.0.1.58694 > 127.0.0.1.8000: Flags [P.], seq 217911224:217911310, ack 3879633684, win 512, options [nop,nop,TS val 2363239505 ecr 2363239505], length 86, ParentProc [ptcpdump.345626]
00:00:00.000116 lo curl.345650 In IP 127.0.0.1.58694 > 127.0.0.1.8000: Flags [P.], seq 217911224:217911310, ack 3879633684, win 512, options [nop,nop,TS val 2363239505 ecr 2363239505], length 86, ParentProc [ptcpdump.345626]
00:00:00.000069 lo curl.345650 Out IP 127.0.0.1.8000 > 127.0.0.1.58694: Flags [.], seq 3879633684, ack 217911310, win 511, options [nop,nop,TS val 2363239505 ecr 2363239505], length 0, ParentProc [ptcpdump.345626]
00:00:00.000082 lo curl.345650 In IP 127.0.0.1.8000 > 127.0.0.1.58694: Flags [.], seq 3879633684, ack 217911310, win 511, options [nop,nop,TS val 2363239505 ecr 2363239505], length 0, ParentProc [ptcpdump.345626]
00:00:00.032743 lo curl.345650 Out IP 127.0.0.1.8000 > 127.0.0.1.58694: Flags [P.], seq 3879633684:3879633870, ack 217911310, win 512, options [nop,nop,TS val 2363239522 ecr 2363239505], length 186, ParentProc [ptcpdump.345626]
00:00:00.000381 lo curl.345650 In IP 127.0.0.1.8000 > 127.0.0.1.58694: Flags [P.], seq 3879633684:3879633870, ack 217911310, win 512, options [nop,nop,TS val 2363239522 ecr 2363239505], length 186, ParentProc [ptcpdump.345626]
00:00:00.000241 lo curl.345650 Out IP 127.0.0.1.58694 > 127.0.0.1.8000: Flags [.], seq 217911310, ack 3879633870, win 511, options [nop,nop,TS val 2363239522 ecr 2363239522], length 0, ParentProc [ptcpdump.345626]
00:00:00.000106 lo curl.345650 In IP 127.0.0.1.58694 > 127.0.0.1.8000: Flags [.], seq 217911310, ack 3879633870, win 511, options [nop,nop,TS val 2363239522 ecr 2363239522], length 0, ParentProc [ptcpdump.345626]
00:00:00.000427 lo curl.345650 Out IP 127.0.0.1.58694 > 127.0.0.1.8000: Flags [F.], seq 217911310, ack 3879634339, win 512, options [nop,nop,TS val 2363239522 ecr 2363239522], length 0, ParentProc [ptcpdump.345626]
00:00:00.000060 lo curl.345650 In IP 127.0.0.1.58694 > 127.0.0.1.8000: Flags [F.], seq 217911310, ack 3879634339, win 512, options [nop,nop,TS val 2363239522 ecr 2363239522], length 0, ParentProc [ptcpdump.345626]
00:00:00.-00243 lo curl.345650 Out IP 127.0.0.1.8000 > 127.0.0.1.58694: Flags [P.], seq 3879633870:3879634339, ack 217911310, win 512, options [nop,nop,TS val 2363239522 ecr 2363239522], length 469, ParentProc [ptcpdump.345626]
00:00:00.000086 lo curl.345650 In IP 127.0.0.1.8000 > 127.0.0.1.58694: Flags [P.], seq 3879633870:3879634339, ack 217911310, win 512, options [nop,nop,TS val 2363239522 ecr 2363239522], length 469, ParentProc [ptcpdump.345626]
00:00:00.000097 lo curl.345650 Out IP 127.0.0.1.58694 > 127.0.0.1.8000: Flags [.], seq 217911310, ack 3879634339, win 508, options [nop,nop,TS val 2363239522 ecr 2363239522], length 0, ParentProc [ptcpdump.345626]
00:00:00.000063 lo curl.345650 In IP 127.0.0.1.58694 > 127.0.0.1.8000: Flags [.], seq 217911310, ack 3879634339, win 508, options [nop,nop,TS val 2363239522 ecr 2363239522], length 0, ParentProc [ptcpdump.345626]
00:00:00.000658 lo curl.345650 Out IP 127.0.0.1.8000 > 127.0.0.1.58694: Flags [F.], seq 3879634339, ack 217911311, win 512, options [nop,nop,TS val 2363239523 ecr 2363239522], length 0, ParentProc [ptcpdump.345626]
00:00:00.000064 lo curl.345650 In IP 127.0.0.1.8000 > 127.0.0.1.58694: Flags [F.], seq 3879634339, ack 217911311, win 512, options [nop,nop,TS val 2363239523 ecr 2363239522], length 0, ParentProc [ptcpdump.345626]
00:00:00.000057 lo curl.345650 Out IP 127.0.0.1.58694 > 127.0.0.1.8000: Flags [.], seq 217911311, ack 3879634340, win 512, options [nop,nop,TS val 2363239523 ecr 2363239523], length 0, ParentProc [ptcpdump.345626]
00:00:00.000052 lo curl.345650 In IP 127.0.0.1.58694 > 127.0.0.1.8000: Flags [.], seq 217911311, ack 3879634340, win 512, options [nop,nop,TS val 2363239523 ecr 2363239523], length 0, ParentProc [ptcpdump.345626]
