13:50:35.524360 lo curl.345650 Out IP 127.0.0.1.58694 > 127.0.0.1.8000: Flags [S], seq 217911223, win 65495, options [mss 65495,sackOK,TS val 2363239505 ecr 0,nop,wscale 7], length 0, ParentProc [ptcpdump.345626]
E..<Z.@.@............F.@.............0.........
..,Q........
13:50:35.524995 lo curl.345650 In IP 127.0.0.1.58694 > 127.0.0.1.8000: Flags [S], seq 217911223, win 65495, options [mss 65495,sackOK,TS val 2363239505 ecr 0,nop,wscale 7], length 0, ParentProc [ptcpdump.345626]
E..<Z.@.@............F.@.............0.........
..,Q........
13:50:35.525108 lo curl.345650 Out IP 127.0.0.1.8000 > 127.0.0.1.58694: Flags [S.], seq 3879633683, ack 217911224, win 65483, options [mss 65495,sackOK,TS val 2363239505 ecr 2363239505,nop,wscale 7], length 0, ParentProc [ptcpdump.345626]
E..<..@.@.<..........@.F.>...........0.........
..,Q..,Q....
13:50:35.525211 lo curl.345650 In IP 127.0.0.1.8000 > 127.0.0.1.58694: Flags [S.], seq 3879633683, ack 217911224, win 65483, options [mss 65495,sackOK,TS val 2363239505 ecr 2363239505,nop,wscale 7], length 0, ParentProc [ptcpdump.345626]
E..<..@.@.<..........@.F.>...........0.........
..,Q..,Q....
13:50:35.525339 lo curl.345650 Out IP 127.0.0.1.58694 > 127.0.0.1.8000: Flags [.], seq 217911224, ack 3879633684, win 512, options [nop,nop,TS val 2363239505 ecr 2363239505], length 0, ParentProc [ptcpdump.345626]
E..4Z @.@............F.@.....>.......(.....
..,Q..,Q
13:50:35.525396 lo curl.345650 In IP 127.0.0.1.58694 > 127.0.0.1.8000: Flags [.], seq 217911224, ack 3879633684, win 512, options [nop,nop,TS val 2363239505 ecr 2363239505], length 0, ParentProc [ptcpdump.345626]
E..4Z @.@............F.@.....>.......(.....
..,Q..,Q
13:50:35.525536 lo curl.345650 Out IP 127.0.0.1.58694 > 127.0.0.1.8000: Flags [P.], seq 217911224:217911310, ack 3879633684, win 512, options [nop,nop,TS val 2363239505 ecr 2363239505], length 86, ParentProc [ptcpdump.345626]
E...Z!@.@..J.........F.@.....>.......~.....
..,Q..,QGET /notfound HTTP/1.1
Host: 127.0.0.1:8000
User-Agent: curl/7.81.0
Accept: */*


13:50:35.525652 lo curl.345650 In IP 127.0.0.1.58694 > 127.0.0.1.8000: Flags [P.], seq 217911224:217911310, ack 3879633684, win 512, options [nop,nop,TS val 2363239505 ecr 2363239505], length 86, ParentProc [ptcpdump.345626]
E...Z!@.@..J.........F.@.....>.......~.....
..,Q..,QGET /notfound HTTP/1.1
Host: 127.0.0.1:8000
User-Agent: curl/7.81.0
Accept: */*


13:50:35.525721 lo curl.345650 Out IP 127.0.0.1.8000 > 127.0.0.1.58694: Flags [.], seq 3879633684, ack 217911310, win 511, options [nop,nop,TS val 2363239505 ecr 2363239505], length 0, ParentProc [ptcpdump.345626]
E..4..@.@............@.F.>...........(.....
..,Q..,Q
13:50:35.525804 lo curl.345650 In IP 127.0.0.1.8000 > 127.0.0.1.58694: Flags [.], seq 3879633684, ack 217911310, win 511, options [nop,nop,TS val 2363239505 ecr 2363239505], length 0, ParentProc [ptcpdump.345626]
E..4..@.@............@.F.>...........(.....
..,Q..,Q
13:50:35.558547 lo curl.345650 Out IP 127.0.0.1.8000 > 127.0.0.1.58694: Flags [P.], seq 3879633684:3879633870, ack 217911310, win 512, options [nop,nop,TS val 2363239522 ecr 2363239505], length 186, ParentProc [ptcpdump.345626]
E.....@.@..9.........@.F.>.................
..,b..,QHTTP/1.0 404 File not found
Server: SimpleHTTP/0.6 Python/3.10.12
Date: Sat, 02 Nov 2024 13:50:35 GMT
Connection: close
Content-Type: text/html;charset=utf-8
Content-Length: 469


13:50:35.558929 lo curl.345650 In IP 127.0.0.1.8000 > 127.0.0.1.58694: Flags [P.], seq 3879633684:3879633870, ack 217911310, win 512, options [nop,nop,TS val 2363239522 ecr 2363239505], length 186, ParentProc [ptcpdump.345626]
E.....@.@..9.........@.F.>.................
..,b..,QHTTP/1.0 404 File not found
Server: SimpleHTTP/0.6 Python/3.10.12
Date: Sat, 02 Nov 2024 13:50:35 GMT
Connection: close
Content-Type: text/html;charset=utf-8
Content-Length: 469


13:50:35.559171 lo curl.345650 Out IP 127.0.0.1.58694 > 127.0.0.1.8000: Flags [.], seq 217911310, ack 3879633870, win 511, options [nop,nop,TS val 2363239522 ecr 2363239522], length 0, ParentProc [ptcpdump.345626]
E..4Z"@.@............F.@.....>.......(.....
..,b..,b
13:50:35.559277 lo curl.345650 In IP 127.0.0.1.58694 > 127.0.0.1.8000: Flags [.], seq 217911310, ack 3879633870, win 511, options [nop,nop,TS val 2363239522 ecr 2363239522], length 0, ParentProc [ptcpdump.345626]
E..4Z"@.@............F.@.....>.......(.....
..,b..,b
13:50:35.559705 lo curl.345650 Out IP 127.0.0.1.58694 > 127.0.0.1.8000: Flags [F.], seq 217911310, ack 3879634339, win 512, options [nop,nop,TS val 2363239522 ecr 2363239522], length 0, ParentProc [ptcpdump.345626]
E..4Z$@.@............F.@.....>.......(.....
..,b..,b
13:50:35.559765 lo curl.345650 In IP 127.0.0.1.58694 > 127.0.0.1.8000: Flags [F.], seq 217911310, ack 3879634339, win 512, options [nop,nop,TS val 2363239522 ecr 2363239522], length 0, ParentProc [ptcpdump.345626]
E..4Z$@.@............F.@.....>.......(.....
..,b..,b
13:50:35.559522 lo curl.345650 Out IP 127.0.0.1.8000 > 127.0.0.1.58694: Flags [P.], seq 3879633870:3879634339, ack 217911310, win 512, options [nop,nop,TS val 2363239522 ecr 2363239522], length 469, ParentProc [ptcpdump.345626]
E..	..@.@............@.F.>.................
..,b..,b<!DOCTYPE HTML PUBLIC "-//W3C//DTD HTML 4.01//EN"
        "http://www.w3.org/TR/html4/strict.dtd">
<html>
    <head>
        <meta http-equiv="Content-Type" content="text/html;charset=utf-8">
        <title>Error response</title>
    </head>
    <body>
        <h1>Error response</h1>
        <p>Error code: 404</p>
        <p>Message: File not found.</p>
        <p>Error code explanation: HTTPStatus.NOT_FOUND - Nothing matches the given URI.</p>
    </body>
</html>

13:50:35.559608 lo curl.345650 In IP 127.0.0.1.8000 > 127.0.0.1.58694: Flags [P.], seq 3879633870:3879634339, ack 217911310, win 512, options [nop,nop,TS val 2363239522 ecr 2363239522], length 469, ParentProc [ptcpdump.345626]
E..	..@.@............@.F.>.................
..,b..,b<!DOCTYPE HTML PUBLIC "-//W3C//DTD HTML 4.01//EN"
        "http://www.w3.org/TR/html4/strict.dtd">
<html>
    <head>
        <meta http-equiv="Content-Type" content="text/html;charset=utf-8">
        <title>Error response</title>
    </head>
    <body>
        <h1>Error response</h1>
        <p>Error code: 404</p>
        <p>Message: File not found.</p>
        <p>Error code explanation: HTTPStatus.NOT_FOUND - Nothing matches the given URI.</p>
    </body>
</html>

13:50:35.559705 lo curl.345650 Out IP 127.0.0.1.58694 > 127.0.0.1.8000: Flags [.], seq 217911310, ack 3879634339, win 508, options [nop,nop,TS val 2363239522 ecr 2363239522], length 0, ParentProc [ptcpdump.345626]
E..4Z#@.@............F.@.....>.......(.....
..,b..,b
13:50:35.559768 lo curl.345650 In IP 127.0.0.1.58694 > 127.0.0.1.8000: Flags [.], seq 217911310, ack 3879634339, win 508, options [nop,nop,TS val 2363239522 ecr 2363239522], length 0, ParentProc [ptcpdump.345626]
E..4Z#@.@............F.@.....>.......(.....
..,b..,b
13:50:35.560427 lo curl.345650 Out IP 127.0.0.1.8000 > 127.0.0.1.58694: Flags [F.], seq 3879634339, ack 217911311, win 512, options [nop,nop,TS val 2363239523 ecr 2363239522], length 0, ParentProc [ptcpdump.345626]
E..4..@.@............@.F.>...........(.....
..,c..,b
13:50:35.560491 lo curl.345650 In IP 127.0.0.1.8000 > 127.0.0.1.58694: Flags [F.], seq 3879634339, ack 217911311, win 512, options [nop,nop,TS val 2363239523 ecr 2363239522], length 0, ParentProc [ptcpdump.345626]
E..4..@.@............@.F.>...........(.....
..,c..,b
13:50:35.560549 lo curl.345650 Out IP 127.0.0.1.58694 > 127.0.0.1.8000: Flags [.], seq 217911311, ack 3879634340, win 512, options [nop,nop,TS val 2363239523 ecr 2363239523], length 0, ParentProc [ptcpdump.345626]
E..4Z%@.@............F.@.....>.......(.....
..,c..,c
13:50:35.560602 lo curl.345650 In IP 127.0.0.1.58694 > 127.0.0.1.8000: Flags [.], seq 217911311, ack 3879634340, win 512, options [nop,nop,TS val 2363239523 ecr 2363239523], length 0, ParentProc [ptcpdump.345626]
E..4Z%@.@............F.@.....>.......(.....
..,c..,c
