00:00:00.000000000 lo curl.345650 Out IP 127.0.0.1.58694 > 127.0.0.1.8000: Flags [S], seq 217911223, win 65495, options [mss 65495,sackOK,TS val 2363239505 ecr 0,nop,wscale 7], length 0, ParentProc [ptcpdump.345626]
00:00:00.000635300 lo curl.345650 In IP 127.0.0.1.58694 > 127.0.0.1.8000: Flags [S], seq 217911223, win 65495, options [mss 65495,sackOK,TS val 2363239505 ecr 0,nop,wscale 7], length 0, ParentProc [ptcpdump.345626]
00:00:00.000747927 lo curl.345650 Out IP 127.0.0.1.8000 > 127.0.0.1.58694: Flags [S.], seq 3879633683, ack 217911224, win 65483, options [mss 65495,sackOK,TS val 2363239505 ecr 2363239505,nop,wscale 7], length 0, ParentProc [ptcpdump.345626]
00:00:00.000851306 lo curl.345650 In IP 127.0.0.1.8000 > 127.0.0.1.58694: Flags [S.], seq 3879633683, ack 217911224, win 65483, options [mss 65495,sackOK,TS val 2363239505 ecr 2363239505,nop,wscale 7], length 0, ParentProc [ptcpdump.345626]
00:00:00.000979659 lo curl.345650 Out IP 127.0.0.1.58694 > 127.0.0.1.8000: Flags [.], seq 217911224, ack 3879633684, win 512, options [nop,nop,TS val 2363239505 ecr 2363239505], length 0, ParentProc [ptcpdump.345626]
00:00:00.001036642 lo curl.345650 In IP 127.0.0.1.58694 > 127.0.0.1.8000: Flags [.], seq 217911224, ack 3879633684, win 512, options [nop,nop,TS val 2363239505 ecr 2363239505], length 0, ParentProc [ptcpdump.345626]
00:00:00.001176036 lo curl.345650 Out IP 127.0.0.1.58694 > 127.0.0.1.8000: Flags [P.], seq 217911224:217911310, ack 3879633684, win 512, options [nop,nop,TS val 2363239505 ecr 2363239505], length 86, ParentProc [ptcpdump.345626]
00:00:00.001292147 lo curl.345650 In IP 127.0.0.1.58694 > 127.0.0.1.8000: Flags [P.], seq 217911224:217911310, ack 3879633684, win 512, options [nop,nop,TS val 2363239505 ecr 2363239505], length 86, ParentProc [ptcpdump.345626]
00:00:00.001361831 lo curl.345650 Out IP 127.0.0.1.8000 > 127.0.0.1.58694: Flags [.], seq 3879633684, ack 217911310, win 511, options [nop,nop,TS val 2363239505 ecr 2363239505], length 0, ParentProc [ptcpdump.345626]
00:00:00.001444453 lo curl.345650 In IP 127.0.0.1.8000 > 127.0.0.1.58694: Flags [.], seq 3879633684, ack 217911310, win 511, options [nop,nop,TS val 2363239505 ecr 2363239505], length 0, ParentProc [ptcpdump.345626]
00:00:00.034187589 lo curl.345650 Out IP 127.0.0.1.8000 > 127.0.0.1.58694: Flags [P.], seq 3879633684:3879633870, ack 217911310, win 512, options [nop,nop,TS val 2363239522 ecr 2363239505], length 186, ParentProc [ptcpdump.345626]
00:00:00.034569529 lo curl.345650 In IP 127.0.0.1.8000 > 127.0.0.1.58694: Flags [P.], seq 3879633684:3879633870, ack 217911310, win 512, options [nop,nop,TS val 2363239522 ecr 2363239505], length 186, ParentProc [ptcpdump.345626]
00:00:00.034811001 lo curl.345650 Out IP 127.0.0.1.58694 > 127.0.0.1.8000: Flags [.], seq 217911310, ack 3879633870, win 511, options [nop,nop,TS val 2363239522 ecr 2363239522], length 0, ParentProc [ptcpdump.345626]
00:00:00.034917748 lo curl.345650 In IP 127.0.0.1.58694 > 127.0.0.1.8000: Flags [.], seq 217911310, ack 3879633870, win 511, options [nop,nop,TS val 2363239522 ecr 2363239522], length 0, ParentProc [ptcpdump.345626]
00:00:00.035345444 lo curl.345650 Out IP 127.0.0.1.58694 > 127.0.0.1.8000: Flags [F.], seq 217911310, ack 3879634339, win 512, options [nop,nop,TS val 2363239522 ecr 2363239522], length 0, ParentProc [ptcpdump.345626]
00:00:00.035405584 lo curl.345650 In IP 127.0.0.1.58694 > 127.0.0.1.8000: Flags [F.], seq 217911310, ack 3879634339, win 512, options [nop,nop,TS val 2363239522 ecr 2363239522], length 0, ParentProc [ptcpdump.345626]
00:00:00.035161901 lo curl.345650 Out IP 127.0.0.1.8000 > 127.0.0.1.58694: Flags [P.], seq 3879633870:3879634339, ack 217911310, win 512, options [nop,nop,TS val 2363239522 ecr 2363239522], length 469, ParentProc [ptcpdump.345626]
00:00:00.035248657 lo curl.345650 In IP 127.0.0.1.8000 > 127.0.0.1.58694: Flags [P.], seq 3879633870:3879634339, ack 217911310, win 512, options [nop,nop,TS val 2363239522 ecr 2363239522], length 469, ParentProc [ptcpdump.345626]
00:00:00.035345797 lo curl.345650 Out IP 127.0.0.1.58694 > 127.0.0.1.8000: Flags [.], seq 217911310, ack 3879634339, win 508, options [nop,nop,TS val 2363239522 ecr 2363239522], length 0, ParentProc [ptcpdump.345626]
00:00:00.035408815 lo curl.345650 In IP 127.0.0.1.58694 > 127.0.0.1.8000: Flags [.], seq 217911310, ack 3879634339, win 508, options [nop,nop,TS val 2363239522 ecr 2363239522], length 0, ParentProc [ptcpdump.345626]
00:00:00.036066888 lo curl.345650 Out IP 127.0.0.1.8000 > 127.0.0.1.58694: Flags [F.], seq 3879634339, ack 217911311, win 512, options [nop,nop,TS val 2363239523 ecr 2363239522], length 0, ParentProc [ptcpdump.345626]
00:00:00.036131250 lo curl.345650 In IP 127.0.0.1.8000 > 127.0.0.1.58694: Flags [F.], seq 3879634339, ack 217911311, win 512, options [nop,nop,TS val 2363239523 ecr 2363239522], length 0, ParentProc [ptcpdump.345626]
00:00:00.036189186 lo curl.345650 Out IP 127.0.0.1.58694 > 127.0.0.1.8000: Flags [.], seq 217911311, ack 3879634340, win 512, options [nop,nop,TS val 2363239523 ecr 2363239523], length 0, ParentProc [ptcpdump.345626]
00:00:00.036241961 lo curl.345650 In IP 127.0.0.1.58694 > 127.0.0.1.8000: Flags [.], seq 217911311, ack 3879634340, win 512, options [nop,nop,TS val 2363239523 ecr 2363239523], length 0, ParentProc [ptcpdump.345626]
