13:48:40.130690 IP 10.0.2.15.47812 > 139.178.84.217.443: Flags [S], seq 4228280971, win 64240, options [mss 1460,sackOK,TS val 3003307950 ecr 0,nop,wscale 7], length 0
13:48:40.365486 IP 139.178.84.217.443 > 10.0.2.15.47812: Flags [S.], seq 854261880, ack 4228280972, win 64240, options [mss 1460], length 0
13:48:40.365704 IP 10.0.2.15.47812 > 139.178.84.217.443: Flags [.], seq 4228280972, ack 854261881, win 64240, length 0
13:48:40.371849 IP 10.0.2.15.47812 > 139.178.84.217.443: Flags [P.], seq 4228280972:4228281489, ack 854261881, win 64240, length 517: TLSv1.0: Client Hello (SNI=kernel.org)
13:48:40.372880 IP 139.178.84.217.443 > 10.0.2.15.47812: Flags [.], seq 854261881, ack 4228281489, win 64240, length 0
13:48:40.606677 IP 139.178.84.217.443 > 10.0.2.15.47812: Flags [P.], seq 854261881:854263293, ack 4228281489, win 64240, length 1412: TLSv1.3: Server Hello
13:48:40.606726 IP 10.0.2.15.47812 > 139.178.84.217.443: Flags [.], seq 4228281489, ack 854263293, win 65535, length 0
